{
  "case_id": "case_0097",
  "description": "WP4.5 coverage case — Shensha (4)",
  "tags": [
    "wp45",
    "golden_expansion",
    "shensha",
    "shensha"
  ],
  "coverage_goal": "Shensha",
  "expected_pattern": "any",
  "expected_score_range": [
    0,
    100
  ],
  "expected_matched_rule_count": {
    "min": 1,
    "max": 2000
  },
  "birth": {
    "gender": "male",
    "solar_datetime": "1969-10-02T14:00:00+07:00",
    "timezone": "Asia/Ho_Chi_Minh",
    "location": {
      "country": "Vietnam",
      "province": "Ha Noi",
      "district": "Dong Da",
      "latitude": 21.0285,
      "longitude": 105.8542
    }
  },
  "options": {
    "calendar": {
      "calendar_type": "solar",
      "use_true_solar_time": true,
      "use_dst": false
    },
    "engine": {
      "language": "vi",
      "rule_database": "v1.0",
      "output_format": "json"
    }
  },
  "upstream": {
    "shensha": {
      "stars": [
        "Thiên Ất Quý Nhân",
        "Văn Xương",
        "Hồng Loan",
        "Lộc Thần",
        "Hoa Cái"
      ],
      "status": "PRESENT"
    }
  },
  "fact_overrides": {
    "than_sat_da_phan_tich": true
  },
  "metadata": {
    "author": "wp45",
    "created_at": "2026-07-24T18:05:29.088437+07:00",
    "dataset_version": "wp45-1.0",
    "notes": "Coverage target: Shensha"
  }
}