{
  "case_id": "case_0067",
  "description": "WP4.5 coverage case — Temperature lạnh (2)",
  "tags": [
    "wp45",
    "golden_expansion",
    "temperature_cold",
    "temperature_lạnh"
  ],
  "coverage_goal": "Temperature lạnh",
  "expected_pattern": "any",
  "expected_score_range": [
    0,
    100
  ],
  "expected_matched_rule_count": {
    "min": 1,
    "max": 2000
  },
  "birth": {
    "gender": "male",
    "solar_datetime": "1966-08-28T04:00:00+07:00",
    "timezone": "Asia/Ho_Chi_Minh",
    "location": {
      "country": "Vietnam",
      "province": "Ha Noi",
      "district": "Dong Da",
      "latitude": 21.0285,
      "longitude": 105.8542
    }
  },
  "options": {
    "calendar": {
      "calendar_type": "solar",
      "use_true_solar_time": true,
      "use_dst": false
    },
    "engine": {
      "language": "vi",
      "rule_database": "v1.0",
      "output_format": "json"
    }
  },
  "upstream": {
    "temperature": {
      "status": "COLD",
      "result": "COLD",
      "cold_score": 85,
      "hot_score": 10,
      "damp_score": 60,
      "dry_score": 15,
      "climate_pattern": "cold_damp",
      "severity": "high"
    }
  },
  "fact_overrides": {
    "temperature_profile_calculated": true,
    "chart_cold": true,
    "temperature_excess_cold": true
  },
  "metadata": {
    "author": "wp45",
    "created_at": "2026-07-24T18:05:29.087626+07:00",
    "dataset_version": "wp45-1.0",
    "notes": "Coverage target: Temperature lạnh"
  }
}