{
  "case_id": "case_0048",
  "description": "WP4.5 coverage case — Thực Thần (3)",
  "tags": [
    "wp45",
    "golden_expansion",
    "thuc_than",
    "thực_thần"
  ],
  "coverage_goal": "Thực Thần",
  "expected_pattern": "thuc_than",
  "expected_score_range": [
    0,
    100
  ],
  "expected_matched_rule_count": {
    "min": 1,
    "max": 2000
  },
  "birth": {
    "gender": "male",
    "solar_datetime": "1964-10-04T10:00:00+07:00",
    "timezone": "Asia/Ho_Chi_Minh",
    "location": {
      "country": "Vietnam",
      "province": "Ha Noi",
      "district": "Dong Da",
      "latitude": 21.0285,
      "longitude": 105.8542
    }
  },
  "options": {
    "calendar": {
      "calendar_type": "solar",
      "use_true_solar_time": true,
      "use_dst": false
    },
    "engine": {
      "language": "vi",
      "rule_database": "v1.0",
      "output_format": "json"
    }
  },
  "upstream": {},
  "fact_overrides": {
    "pattern_la_thuc_than_cach": true,
    "xuat_tinh_ton_tai": true,
    "xuat_tinh_thanh_cach": true
  },
  "metadata": {
    "author": "wp45",
    "created_at": "2026-07-24T18:05:29.085492+07:00",
    "dataset_version": "wp45-1.0",
    "notes": "Coverage target: Thực Thần"
  }
}