{
  "case_id": "case_0055",
  "description": "WP4.5 coverage case — Tỷ Kiên (2)",
  "tags": [
    "wp45",
    "golden_expansion",
    "ty_kien",
    "tỷ_kiên"
  ],
  "coverage_goal": "Tỷ Kiên",
  "expected_pattern": "ty_kien",
  "expected_score_range": [
    0,
    100
  ],
  "expected_matched_rule_count": {
    "min": 1,
    "max": 2000
  },
  "birth": {
    "gender": "male",
    "solar_datetime": "1965-06-09T16:00:00+07:00",
    "timezone": "Asia/Ho_Chi_Minh",
    "location": {
      "country": "Vietnam",
      "province": "Ha Noi",
      "district": "Dong Da",
      "latitude": 21.0285,
      "longitude": 105.8542
    }
  },
  "options": {
    "calendar": {
      "calendar_type": "solar",
      "use_true_solar_time": true,
      "use_dst": false
    },
    "engine": {
      "language": "vi",
      "rule_database": "v1.0",
      "output_format": "json"
    }
  },
  "upstream": {},
  "fact_overrides": {
    "pattern_la_ty_kiep_cach": true,
    "ty_kiep_ton_tai": true,
    "ty_kiep_thanh_cach": true
  },
  "metadata": {
    "author": "wp45",
    "created_at": "2026-07-24T18:05:29.086184+07:00",
    "dataset_version": "wp45-1.0",
    "notes": "Coverage target: Tỷ Kiên"
  }
}