{
  "case_id": "case_0011",
  "description": "WP4.5 coverage case — Weak Day Master (5)",
  "tags": [
    "wp45",
    "golden_expansion",
    "weak_day_master",
    "weak_day_master"
  ],
  "coverage_goal": "Weak Day Master",
  "expected_pattern": "any",
  "expected_score_range": [
    0,
    100
  ],
  "expected_matched_rule_count": {
    "min": 1,
    "max": 2000
  },
  "birth": {
    "gender": "female",
    "solar_datetime": "1961-01-26T21:00:00+07:00",
    "timezone": "Asia/Ho_Chi_Minh",
    "location": {
      "country": "Vietnam",
      "province": "Ha Noi",
      "district": "Dong Da",
      "latitude": 21.0285,
      "longitude": 105.8542
    }
  },
  "options": {
    "calendar": {
      "calendar_type": "solar",
      "use_true_solar_time": true,
      "use_dst": false
    },
    "engine": {
      "language": "vi",
      "rule_database": "v1.0",
      "output_format": "json"
    }
  },
  "upstream": {},
  "fact_overrides": {
    "weak_day_master": true,
    "strength_nhuoc": true,
    "day_master_strength_calculated": true
  },
  "metadata": {
    "author": "wp45",
    "created_at": "2026-07-24T18:05:29.084489+07:00",
    "dataset_version": "wp45-1.0",
    "notes": "Coverage target: Weak Day Master"
  }
}